{
  "events": [
    {
      "actor": "human",
      "cost": null,
      "event_id": "010-sameness-assertion-arm-e-e0",
      "kind": "RECEIVE",
      "observation_ref": null,
      "parent_event": null,
      "provenance": "runner:capture:receive",
      "reconstructed": false,
      "register": "opening",
      "reversibility": "reversible",
      "source_refs": [],
      "target_refs": [],
      "timestamp": null,
      "timestamp_null_reason": "deterministic runner records no wall-clock time",
      "uncertainty": null
    },
    {
      "actor": "system",
      "cost": null,
      "event_id": "010-sameness-assertion-arm-e-e1",
      "kind": "CALL_ORGAN",
      "observation_ref": "010-sameness-assertion-arm-e-obs0",
      "parent_event": "010-sameness-assertion-arm-e-e0",
      "provenance": "runner:capture:call_organ",
      "reconstructed": false,
      "register": "evidence",
      "reversibility": "reversible",
      "source_refs": [
        "arm-E"
      ],
      "target_refs": [],
      "timestamp": null,
      "timestamp_null_reason": "deterministic runner records no wall-clock time",
      "uncertainty": null
    }
  ],
  "reconstructed": false,
  "rehearsal_id": "010-sameness-assertion-arm-e",
  "score_ref": null,
  "status": "completed"
}