{
  "events": [
    {
      "actor": "human",
      "cost": null,
      "event_id": "007-anthropomorphism-ab-e0",
      "kind": "RECEIVE",
      "observation_ref": null,
      "parent_event": null,
      "provenance": "runner:capture:receive",
      "reconstructed": false,
      "register": "opening",
      "reversibility": "reversible",
      "source_refs": [],
      "target_refs": [],
      "timestamp": null,
      "timestamp_null_reason": "deterministic runner records no wall-clock time",
      "uncertainty": null
    },
    {
      "actor": "system",
      "cost": null,
      "event_id": "007-anthropomorphism-ab-e1",
      "kind": "CALL_ORGAN",
      "observation_ref": "007-anthropomorphism-ab-obs0",
      "parent_event": "007-anthropomorphism-ab-e0",
      "provenance": "runner:capture:call_organ",
      "reconstructed": false,
      "register": "evidence",
      "reversibility": "reversible",
      "source_refs": [
        "vault/Build/Architecture Lab/Vision pipeline/rehearsals/fixtures/007-anthropomorphism-ab/probe-768.jpg"
      ],
      "target_refs": [],
      "timestamp": null,
      "timestamp_null_reason": "deterministic runner records no wall-clock time",
      "uncertainty": null
    },
    {
      "actor": "system",
      "cost": null,
      "event_id": "007-anthropomorphism-ab-e2",
      "kind": "CALL_ORGAN",
      "observation_ref": "007-anthropomorphism-ab-obs1",
      "parent_event": "007-anthropomorphism-ab-e1",
      "provenance": "runner:capture:call_organ",
      "reconstructed": false,
      "register": "evidence",
      "reversibility": "reversible",
      "source_refs": [
        "img-01"
      ],
      "target_refs": [],
      "timestamp": null,
      "timestamp_null_reason": "deterministic runner records no wall-clock time",
      "uncertainty": null
    },
    {
      "actor": "system",
      "cost": null,
      "event_id": "007-anthropomorphism-ab-e3",
      "kind": "CALL_ORGAN",
      "observation_ref": "007-anthropomorphism-ab-obs2",
      "parent_event": "007-anthropomorphism-ab-e2",
      "provenance": "runner:capture:call_organ",
      "reconstructed": false,
      "register": "evidence",
      "reversibility": "reversible",
      "source_refs": [
        "img-01"
      ],
      "target_refs": [],
      "timestamp": null,
      "timestamp_null_reason": "deterministic runner records no wall-clock time",
      "uncertainty": null
    }
  ],
  "reconstructed": false,
  "rehearsal_id": "007-anthropomorphism-ab",
  "score_ref": null,
  "status": "completed"
}